{
  "$schema": "../../../.schemas/texture.schema.json",
  "id": "testTexture",
  "fileName": "/debugger/assets/testTextures/Poliigon_MetalRust_7642_BaseColor.jpg",
  "useHDRLoader": false,
  "__saveData": {
    "sceneTestECS": [
      {
        "__meta": { "date": 1779449688109 },
        "useHDRLoader": true
      }
    ]
  }
}
